anime_id,mal_id,title,english_title,japanese_title,user_preferred_title,type,episodes,duration,status,source,season,season_year,studios,main_studios,genres,tags,rating,score,mean_score,scored_by,rank,popularity,popularity_rank,members,favorites,watching,completed,on_hold,dropped,plan_to_watch,start_date,end_date,broadcast_day,broadcast_time,synopsis,country_of_origin,is_licensed,hashtag,cover_image_large,cover_image_color,banner_image,trailer_site,trailer_id,main_characters,main_staff,streaming_sites,is_adult,synonyms,site_url,updated_at,next_airing_episode_at,next_episode_number,collected_at,data_source
193413,61273.0,Tsurezure PoPiPa,,つれづれポピパ ,Tsurezure PoPiPa,ONA,10.0,1.0,FINISHED,OTHER,SPRING 2025,2025,Bushiroad;STUDIO MORIKEN,STUDIO MORIKEN,Comedy;Slice of Life,Cute Girls Doing Cute Things;School;Female Protagonist;Primarily Female Cast;Food;Tsundere;Episodic;Primarily Teen Cast,,55.0,64.0,0,0,357,0,357,5,53,115,9,16,164,2025-04-28,2025-08-27,,,A series of shorts showing the daily lives of the Poppin'Party members and celebrating the group's 10th anniversary.,JP,True,#つれづれポピパ,https://s4.anilist.co/file/anilistcdn/media/anime/cover/medium/bx193413-OPcwqduN7GMJ.png,#86e4bb,,youtube,Z2ZzO_EQY0Q,Kasumi Toyama;Arisa Ichigaya;Rimi Ushigome;Tae Hanazono;Saaya Yamabuki,Bushiroad  (Original Creator);Kenshirou Morii (Director),YouTube,False,Poppin'Party's Ordinary Days,https://anilist.co/anime/193413,1763457841,0,0,2025-11-22T04:12:42.749199+00:00,anilist
185716,60595.0,Hyakushou Kizoku 2nd Season OVA,,百姓貴族 2nd Season OVA,Hyakushou Kizoku 2nd Season OVA,OVA,2.0,5.0,FINISHED,MANGA,SPRING 2025,2025,Pie in the sky,Pie in the sky,Comedy;Slice of Life,Shoujo;Agriculture;Autobiographical,,55.0,65.0,0,0,357,0,357,0,13,117,4,28,195,2025-04-23,2025-04-23,,,2 OVAs bundled with the manga's 8.1st volume.,JP,True,#百姓貴族,https://s4.anilist.co/file/anilistcdn/media/anime/cover/medium/bx185716-LYQR7AFNEC0m.jpg,#ffd635,,,,Hiromu Arakawa;Ishii-san,Hiromu Arakawa (Original Creator),Official Site;Twitter,False,Hyakusho Kizoku-the farmer's days 2 OVA;十勝へGO！;Tokachi e GO!;百姓貴族 第2期 OVA,https://anilist.co/anime/185716,1763718413,0,0,2025-11-22T04:12:42.749216+00:00,anilist
189891,61411.0,Kanchigai no Atelier Meister Mini Anime,,勘違いの工房主ミニアニメ,Kanchigai no Atelier Meister Mini Anime,ONA,14.0,2.0,FINISHED,LIGHT_NOVEL,SPRING 2025,2025,,,Comedy,,,48.0,54.0,0,0,331,0,331,4,44,116,10,24,137,2025-04-06,2025-06-27,,,"Mini anime of <i>Kanchigai no Atelier Meister: Eiyuu Party no Moto Zatsuyougakari ga, Jitsu wa Sentou Igai ga SSS Rank Datta to Iu Yoku Aru Hanashi</i>.",JP,True,,https://s4.anilist.co/file/anilistcdn/media/anime/cover/medium/bx189891-UvNQzMMStf94.png,#e4bba1,,youtube,DCHBlLf3kxg,Kurt Rockhans;Yulishia;Liselotte Homuros,Yousuke Tokino (Original Story);Zounose (Original Character Design),Twitter;YouTube,False,The Unaware Atelier Meister Mini Anime,https://anilist.co/anime/189891,1763544469,0,0,2025-11-22T04:12:42.749232+00:00,anilist
187304,61164.0,Inshoku-Ou Demar,,淫触王デマール,Inshoku-Ou Demar,OVA,,30.0,RELEASING,ORIGINAL,SPRING 2025,2025,Pink Pineapple;Seven,Seven,Hentai,Tentacles;Rape;Monster Boy;Double Penetration;Fellatio,,53.0,64.0,0,0,303,0,303,15,94,30,33,16,130,2025-05-30,,,,"Rosalia is a beautiful adventurer who once hunted demons alongside heroes. After retiring from the front lines, she ran an orphanage in a remote area, living a quiet life while taking in orphaned children. But one day, she found an insect in the orphanage... It was a split body of Demar, the King of Lust, a powerful enemy she had defeated during her time as an adventurer. <i>""You can't be... you're still looking for me...""</i> Rosalia stood alone, trying to ward off the demonic clutches of revenge, but countless tentacles attacked her ripe body――!?<br> <br> (Source: PinkPineapple, translated)",JP,True,,https://s4.anilist.co/file/anilistcdn/media/anime/cover/medium/bx187304-CwTKRUiG6kRd.png,#fea128,,,,Rosalia;Demar,Ao Ishii (Director),,True,Roi des tentacules obscènes Demar,https://anilist.co/anime/187304,1763756844,0,0,2025-11-22T04:12:42.749264+00:00,anilist
186935,61077.0,Dragon Heart: Reikai Tanbouki,,ドラゴン・ハート―霊界探訪記―,Dragon Heart: Reikai Tanbouki,MOVIE,1.0,119.0,FINISHED,ORIGINAL,SPRING 2025,2025,HS PICTURES,HS PICTURES,Fantasy;Supernatural,,,,53.0,0,0,301,0,301,2,29,18,9,12,233,2025-05-23,2025-05-23,,,,JP,True,,https://s4.anilist.co/file/anilistcdn/media/anime/cover/medium/bx186935-WPDw5KNiCSGb.png,#f1bb5d,,youtube,Y8gFzZDNjLM,,Ryuuhou Ookawa (Executive Producer);Ryuuhou Ookawa (Original Creator);Isamu Imakake (Director);Yuuichi Mizusawa (Music),Official Site;Official Site,False,Dragon Heart - Adventures Beyond This World,https://anilist.co/anime/186935,1763458628,0,0,2025-11-22T04:12:42.749285+00:00,anilist
186313,60947.0,Nmeneko,,ンめねこ,Nmeneko,TV_SHORT,,2.0,RELEASING,OTHER,SPRING 2025,2025,Kumarba;TBS;HUNET;Kumarba,Kumarba,Comedy,Animals;Primarily Animal Cast;Episodic;Iyashikei;Food;Chibi;Crossover,,,54.0,0,0,294,0,294,4,101,8,13,56,116,2025-04-04,,,,Follows the funny and amusing daily lives of two cats who want to live life doing only fun things. <br><br> (Source: Anime News Network),JP,True,,https://s4.anilist.co/file/anilistcdn/media/anime/cover/medium/bx186313-29gCf3CWJu1n.jpg,#f1ae28,,youtube,6yBpNLsdXX4,Nmeneko;Usukuro;Miku Hatsune,Shirimoto (Original Creator);Tommy Hino (Director);Hideaki Shirasaka (Series Composition);Hideaki Shirasaka (Script);Maju Arai (Theme Song Performance (ED1)),Official Site;Twitter;YouTube;Instagram,False,,https://anilist.co/anime/186313,1763760090,1764262680,34,2025-11-22T04:12:42.749308+00:00,anilist
191370,56640.0,JUNK WORLD,,JUNK WORLD,JUNK WORLD,MOVIE,1.0,105.0,FINISHED,ORIGINAL,SPRING 2025,2025,Aniplex;Yamiken,Yamiken,Action;Adventure;Sci-Fi;Thriller,Philosophy;Stop Motion,,,46.0,0,0,288,0,288,2,13,17,2,13,243,2025-06-13,2025-06-13,,,A prequel film to <i>Junk Head</i>.,JP,True,#JUNKWORLD,https://s4.anilist.co/file/anilistcdn/media/anime/cover/medium/bx191370-w0h51nHzJ1Qo.png,#6b501a,,youtube,bKT8_sRMCpI,,Takahide Hori (Director);Takahide Hori (Character Design);Takahide Hori (Director of Photography);Takahide Hori (Editing);Takahide Hori (Sound Effects),Official Site;Twitter;TikTok,False,,https://anilist.co/anime/191370,1763716931,0,0,2025-11-22T04:12:42.749328+00:00,anilist
189892,61331.0,Petit Forma: Denpa Kyoku Nisshi,YOUR FORMA: Mini-Anime,プチフォルマ～電犯局日誌～,Petit Forma: Denpa Kyoku Nisshi,ONA,5.0,2.0,FINISHED,LIGHT_NOVEL,SPRING 2025,2025,Geno Studio;KADOKAWA,Geno Studio,Mystery;Sci-Fi,,,48.0,55.0,0,0,236,0,236,1,25,90,8,33,80,2025-03-28,2025-06-24,,,The anime is a spin-off that follows the everyday lives of SD versions of Echika and friends. <br><br> (Source: Anime News Network),JP,True,,https://s4.anilist.co/file/anilistcdn/media/anime/cover/medium/bx189892-ZFli3O2ZX5wS.png,#e4c9ae,,youtube,2G_K26c6PqQ,Echika Hieda;Harold W. Lucraft,Mareho Kikuishi (Original Story);Tsubata Nozaki (Original Character Design),YouTube;Twitter;YouTube,False,Mini Forma: Diary of the Cybercrime Investigation Department;Petit Forma: Electrocrime Bureau Journal,https://anilist.co/anime/189892,1763458236,0,0,2025-11-22T04:12:42.749345+00:00,anilist
194889,62873.0,Aikatsu! Memorial Stage: Kagayaki no Unit Cup,,アイカツ！メモリアルステージ ～輝きのユニットカップ～,Aikatsu! Memorial Stage: Kagayaki no Unit Cup,MOVIE,1.0,93.0,FINISHED,OTHER,SPRING 2025,2025,Bandai Namco Pictures;Dentsu;Bandai;TV Tokyo,Bandai Namco Pictures,Music,Idol;Female Protagonist;Primarily Female Cast;Fashion;Acting;Kids;School;CGI,,,77.0,0,0,177,0,177,0,10,22,4,8,133,2025-06-20,2025-06-20,,,"Compilation film of <i>Aikatsu!</i>'s 3rd Season's ""Aikatsu Restaurant"" episode (ep. 140), followed by the ""Unit Cup"" arc (eps. 136-138), also featuring new segments with commentary from Akari, Madoka, Juri and Sumire. A part of the 10th anniversary celebrations of the <i>Akari Generation</i>. <br><br> After an announcement that a ""Unit Cup"" will be held at Starlight Academy's middle school, the eight performing two-member units are as motivated as they can be. This time, the event's broadcast will also feature a special corner where the idols report on each other's true faces behind the scenes. Is it time for the idols to clash with each other more passionately than ever?! The curtain rises on the Unit Cup right here and now! <br><br> (Source: Official Website, translated)",JP,True,#aikatsu #アイカツ,https://s4.anilist.co/file/anilistcdn/media/anime/cover/medium/bx194889-OtxR64ftu3R3.png,#f1bb50,https://s4.anilist.co/file/anilistcdn/media/anime/banner/194889-uOiF3l4Co9ro.jpg,youtube,aSzhZMrmyE8,"Akari
 Oozora;Sumire
 Hikami;Hinaki Shinjou;Juri Kurebayashi;Rin Kurosawa",Bandai Namco Pictures (Original Creator);Ryuuichi Kimura (Director);Hiroko Yaguchi (Character Design);Nobuhiro Nagayoshi (Editing);Hiromi Kikuta (Sound Director),Twitter;Official Site;YouTube,False, Aikatsu! Memorial Stage ~Shining Unit Cup~	,https://anilist.co/anime/194889,1763731266,0,0,2025-11-22T04:12:42.749368+00:00,anilist
188239,61258.0,Transformers: Wild King,,トランスフォーマー ワイルドキング,Transformers: Wild King,ONA,14.0,4.0,RELEASING,OTHER,SPRING 2025,2025,Infinity Vision;Type ZERO,Infinity Vision;Type ZERO,Action;Mecha;Sci-Fi,Full CGI;Super Robot;Shapeshifting;Animals;Dinosaurs;Cars;Advertisement,,,48.0,0,0,175,0,175,4,51,6,11,40,67,2025-03-26,,,,"The story takes place on the planet Elementros, which has unknown powers. The main character, Optimus Prime, follows his friend Megatron and lands on this planet. There, Optimus meets Lightlong, a giraffe-type Transformer who is an energy beast. According to Lightlong, the energy beasts that live on Elementros in the form of animals and dinosaurs have five elements of ""element energy"" hidden within them: fire, water, earth, nature, and lightning. Suddenly, Megatron attacks. Optimus and Lightlong use the power of their bond to awaken the ability to transform and combine [Wild King]. Optimus joins forces with the animals, and Megatron commands the dinosaurs. What will be its fate?! <br><br> (Source: Youtube)",JP,True,#トランスフォーマー #ワイルドキング,https://s4.anilist.co/file/anilistcdn/media/anime/cover/medium/bx188239-ktV7LXrb8yHH.png,#f1c935,,youtube,2NZxM00c_Lo,Convoy;Megatron,Takara Tomy (Original Creator);Tomoki Yoshisawa (Director);Takahiro Nagano (Series Composition);Naoki Yamashita (CG Director);Takumi Itou (Sound Director),Official Site;YouTube;Twitter,False,,https://anilist.co/anime/188239,1763756844,1765933200,13,2025-11-22T04:12:42.749388+00:00,anilist
177633,58908.0,MUZIK TIGER In the Forest,,MUZIK TIGER In the Forest,MUZIK TIGER In the Forest,TV_SHORT,13.0,1.0,FINISHED,OTHER,SPRING 2025,2025,Shin-Ei Animation;Daewon Media;TOHO animation STUDIO,TOHO animation STUDIO,Slice of Life,Animals;Primarily Animal Cast;Anthropomorphism;No Dialogue;Iyashikei;Episodic;Ensemble Cast,,,51.0,0,0,171,0,171,1,19,54,3,29,66,2025-04-02,2025-06-25,,,"The <i>MUZIK TIGER</i> franchise centers on Toffee, a tiger that lives in the forest with other animal friends. <br><br> (Source: Anime News Network)",JP,True,#MUZIKTIGER,https://s4.anilist.co/file/anilistcdn/media/anime/cover/medium/bx177633-LY9wFxN1TRF6.png,#e49328,,youtube,WWpqu3_9sZ8,Toffee;Willy;Taffee;Teefee;Porumee,Kazunori Minagawa (Director);Miki Minagawa (Director);Ikki Kuwahara (Sound Director);Hiroaki Tsutsumi (Music);Toshizou Nemoto (Script),Official Site;Official Site;Official Site;Twitter;Instagram;Instagram;Twitter;YouTube;YouTube;YouTube,False,ムジク・タイガー;무직타이거;MUZIK FOREST（ムジークフォレスト）,https://anilist.co/anime/177633,1763641774,0,0,2025-11-22T04:12:42.749409+00:00,anilist
188131,61238.0,Chikuwa Senki: Ore no Kawaii de Chikyuu Shinryaku ,,ちくわ戦記～おれのカワイイで地球侵略～,Chikuwa Senki: Ore no Kawaii de Chikyuu Shinryaku ,TV_SHORT,12.0,3.0,FINISHED,MANGA,SPRING 2025,2025,Imageworks Studio;Imagica Infos,Imageworks Studio;Imagica Infos,Comedy;Sci-Fi,Flash,,,37.0,0,0,170,0,170,4,19,19,6,24,102,2025-04-08,2025-06-24,,,,JP,True,#ちくわアニメ,https://s4.anilist.co/file/anilistcdn/media/anime/cover/medium/bx188131-99m0d0jIBAUg.png,#f1c943,,youtube,G3yP4IKb9DM,Chikuwa;Madoka;Banjirou;Greppler Seijin;Nene,Bubu (Original Creator);Mizuno Satoshi (Director);Mizuno Satoshi (Series Composition);Riza Kouzai (Art Director);Yukari Oomachi (Color Design),Official Site,False,Chikuwa Wars,https://anilist.co/anime/188131,1763198733,0,0,2025-11-22T04:12:42.749428+00:00,anilist
185718,60596.0,Sai-Kyo-Oh! Zukan: The Ultimate Tournament,,最強王図鑑 ～The Ultimate Tournament～,Sai-Kyo-Oh! Zukan: The Ultimate Tournament,TV_SHORT,,11.0,RELEASING,OTHER,SPRING 2025,2025,OLM,OLM,Action,Ensemble Cast;Animals;Dinosaurs;Dragons;Full CGI;Educational,,,57.0,0,0,166,0,166,3,64,2,7,32,61,2025-04-06,,,,Sequel to <i>Sai-Kyo-Oh! Zukan: The Ultimate Battles.</i>,JP,True,#最強王,https://s4.anilist.co/file/anilistcdn/media/anime/cover/medium/bx185718-luZZKvM7pOZ2.png,#1aaed6,,youtube,lf2aU1au_Ho,Mr. Most,Kunihiko Yuyama (Chief Director);Makoto Satou (Director);Shinji Satou (Series Composition);Toonz Imai (Character Design);Kisuke Koizumi (Sound Director),Twitter;Official Site;YouTube,False,,https://anilist.co/anime/185718,1763529911,1763849760,34,2025-11-22T04:12:42.749445+00:00,anilist
188884,61300.0,Sumikko Gurashi: Koko ga Ochitsukun Desu,,すみっコぐらし ここがおちつくんです,Sumikko Gurashi: Koko ga Ochitsukun Desu,TV_SHORT,,1.0,RELEASING,ORIGINAL,SPRING 2025,2025,San-X;Fanworks,Fanworks,Slice of Life,,,,65.0,0,0,157,0,157,2,24,11,5,27,90,2025-04-04,,,,,JP,True,#テレビアニメすみっコぐらし,https://s4.anilist.co/file/anilistcdn/media/anime/cover/medium/bx188884-pmEMLEcpTovv.png,#e4c993,,youtube,3cARhyfoZJU,Shirokuma;Penguin?;Tonkatsu;Tokage,Yuri Yokomizo (Original Creator);Gaku Kinoshita (Director);Gaku Kinoshita (Episode Director),Twitter;Official Site;Instagram;YouTube,False,,https://anilist.co/anime/188884,1763729718,0,0,2025-11-22T04:12:42.749462+00:00,anilist
193242,61491.0,Chibizenji-sensei Inokori Kougiroku,,ちびぜんじ先生 居残り講義録,Chibizenji-sensei Inokori Kougiroku,ONA,12.0,2.0,FINISHED,MANGA,SPRING 2025,2025,Pony Canyon;Dou-Raku,Dou-Raku,Comedy;Mystery,,,,57.0,0,0,125,0,125,2,18,49,4,10,44,2025-04-08,2025-06-24,,,Mini anime for <i>Chuuzenji-sensei Mononoke Kougiroku: Sensei ga Nazo wo Hodoite Shimau kara.</i> released on YouTube.,JP,True,#ちびぜんじ先生 ,https://s4.anilist.co/file/anilistcdn/media/anime/cover/medium/bx193242-0pIv8EQ3ijOA.png,#e4c9ae,,youtube,Ed3ra6uZRus,Akihiko Chuuzenji;Kanna Kusakabe;Tatsumi Sekiguchi;Shutarou Kiba;Reijirou Enokizu,Aki Shimizu (Original Creator);Natsuhiko Kyougoku (Original Creator);Kapico (Director);Toshiki Kameyama (Sound Director);Ryuuichi Takada (Music),Official Site,False,中禅寺先生ミニアニメ;Chuuzenji-sensei Mini Anime,https://anilist.co/anime/193242,1763457857,0,0,2025-11-22T04:12:42.749482+00:00,anilist
185715,60612.0,SHIBUYA♡HACHI Part 3,,SHIBUYA♡HACHI 第3クール,SHIBUYA♡HACHI Part 3,TV_SHORT,13.0,3.0,FINISHED,ORIGINAL,SPRING 2025,2025,Nippon Animation,Nippon Animation,Slice of Life,Kids;Animals;Primarily Animal Cast,,,55.0,0,0,122,0,122,0,12,27,3,28,52,2025-04-05,2025-06-28,,,Sequel to <i>SHIBUYA♡HACHI Part 2.</i>,JP,True,#ラブハチ #lovehachi,https://s4.anilist.co/file/anilistcdn/media/anime/cover/medium/bx185715-S5OtxSJTo5k1.png,#1aaef1,,youtube,m18b_LPe-DU,Hachi;Nana;Kuro;Mike;Harii,Yuuji Umoto (Director);Ryousuke Aoike (Series Composition);Shinichi Nakazono (Art Director);Shinichi Natori (Editing);Hiroyuki Hayase (Sound Director),Twitter;Official Site,False,シブヤラブハチ 第3クール;SHIBUYA LOVE HACHI Part 3,https://anilist.co/anime/185715,1763286119,0,0,2025-11-22T04:12:42.749504+00:00,anilist
185645,58631.0,Oshiri Tantei 9,,おしりたんてい(第9シリーズ),Oshiri Tantei 9,TV,8.0,20.0,FINISHED,OTHER,SPRING 2025,2025,Toei Animation,Toei Animation,Comedy;Fantasy;Mystery,,,,14.0,0,0,118,0,118,1,12,15,2,44,45,2025-04-05,2025-05-24,,,Ninth season of <i>Oshiri Tantei</i>.,JP,True,,https://s4.anilist.co/file/anilistcdn/media/anime/cover/medium/bx185645-oURiWI3bVWgq.png,#e4bb5d,,youtube,osT3ZB9IZEg,Oshiri Tantei;Kaitou U;Kaitou B;Kaitou G;Kaitou H,,Official Site,False,Butt Detective 9,https://anilist.co/anime/185645,1761816379,0,0,2025-11-22T04:12:42.749522+00:00,anilist
180124,61198.0,Tabekko Doubutsu THE MOVIE,Dream Animals THE MOVIE,たべっ子どうぶつ THE MOVIE,Tabekko Doubutsu THE MOVIE,MOVIE,1.0,90.0,FINISHED,OTHER,SPRING 2025,2025,Marza Animation Planet;TBS,Marza Animation Planet,Action;Adventure;Fantasy,,,,60.0,0,0,112,0,112,0,8,14,2,26,62,2025-05-01,2025-05-01,,,"Dream Animals biscuits, a long-selling snack beloved by Japanese since its launch in 1978 has been sold in more than 20 countries around the world and features the animal names written in English on the biscuits. The product has enjoyed an explosion in popularity in recent years as merchandise, especially among young people. Now for the first time, the product is given treatment as an animated movie called Dream Animals: The Movie. How will these animal biscuit characters behave and sound as they embark upon a thrilling adventure while tugging at your heartstrings with endearingly rich personalities. <br><br> (Source: TBS)",JP,True,#映画たべっ子どうぶつ,https://s4.anilist.co/file/anilistcdn/media/anime/cover/medium/b180124-kLrE636DrdKx.png,#e49335,,youtube,6JyMnxSdbXg,,Hitoshi Takekiyo (Director);Kiyoaki Kamei (Art Director);Kyousuke Sakai (CG Supervisor);Chikako Yokota (Sound Director);Masato Ui (Animation Producer),Instagram;TikTok;Twitter;Official Site,False,,https://anilist.co/anime/180124,1762768869,0,0,2025-11-22T04:12:42.749541+00:00,anilist
184182,60280.0,Zenryoku Usagi Season 2,,全力ウサギシーズン2,Zenryoku Usagi Season 2,TV_SHORT,12.0,5.0,FINISHED,MANGA,SPRING 2025,2025,Rising Force;Theatre Academy;PICKUP;Bros.Bird,Rising Force,Comedy,Primarily Animal Cast;Anthropomorphism;Animals;Work;Kids,,,40.0,0,0,98,0,98,0,8,13,1,30,46,2025-04-09,2025-06-25,,,Second season of <i>Zenryoku Usagi (2023)</i>.,JP,True,,https://s4.anilist.co/file/anilistcdn/media/anime/cover/medium/bx184182-1VaS86GSiMOE.png,#f1bb50,,youtube,8kUw8KyMrhg,Minarai;Eigyou;Oyakata;Souchou;Ojou,Ikeda Kei (Original Creator);Atsushi Nigorikawa (Director);Miki Urashima (Character Design);Mutsuki Nagahama (Character Design);Daisuke Negishi (Art Director),Twitter;Official Site;TikTok;YouTube,False,Constructor Rabbit (2025);Zenryoku Usagi (2023) 2nd Season;Zenryoku Usagi (2025),https://anilist.co/anime/184182,1762507775,0,0,2025-11-22T04:12:42.749562+00:00,anilist
186542,60962.0,Soreike! Anpanman: Chapon no Hero!,,それいけ！アンパンマン チャポンのヒーロー！,Soreike! Anpanman: Chapon no Hero!,MOVIE,1.0,59.0,FINISHED,ORIGINAL,SPRING 2025,2025,TMS Entertainment;VAP;Nippon Television Network;TMS Entertainment,TMS Entertainment,Comedy;Fantasy,,,,40.0,0,0,87,0,87,2,9,11,3,18,46,2025-06-27,2025-06-27,,,"The film centers on Chapon, a mysterious boy who falls from the sky without any knowledge of where he came from. Staying with Anpanman, he one day helps someone out and gets to know the joy of making someone smile, and dreams of becoming a hero like Anpanman. But when Baikinman arrives, and reveals the secret of Chapon's origins, Chapon must figure out if his origins or his dreams define who he is. <br><br> (Source: Anime News Network)",JP,True,#映画アンパンマン,https://s4.anilist.co/file/anilistcdn/media/anime/cover/medium/bx186542-m9q64FHGRQXs.png,#ffbb00,,youtube,https://youtu.be/vVzcYRIH8g4,Anpanman;Baikinman;Chapon;Shokupanman;Currypanman,Takashi Yanase (Original Creator);Toshikazu Hashimoto (Director);Takao Imaizumi (Music);Hiroaki Kondou (Music);Shuuji Kuzuhara (Script),Twitter;Official Site,False,,https://anilist.co/anime/186542,1762853507,0,0,2025-11-22T04:12:42.749585+00:00,anilist
188661,61279.0,Go! Go! Vehicle Zoo: Norimono Star-hen,,ゴー！ゴー！びーくるずー のりものスター編 ,Go! Go! Vehicle Zoo: Norimono Star-hen,TV_SHORT,13.0,3.0,FINISHED,OTHER,SPRING 2025,2025,,,Slice of Life,Cars;Kids,,,57.0,0,0,81,0,81,0,12,18,3,22,26,2025-04-06,2025-06-29,,,Second season of <i>Go! Go! Vehicle Zoo</i>.,JP,True,,https://s4.anilist.co/file/anilistcdn/media/anime/cover/medium/bx188661-I48XaB1Bvkju.png,#e4ae0d,,youtube,B2HNFkNK7w8,Rettsu;Burun;Pao;Garun;Mimi,Takara Tomy (Original Creator),Official Site;YouTube,False,Go! Go! Vehicle Zoo: Vehicle Star-hen,https://anilist.co/anime/188661,1763717932,0,0,2025-11-22T04:12:42.749602+00:00,anilist
189602,61363.0,YouTuNya 3,,ユーチューニャー 第3期 ,YouTuNya 3,TV_SHORT,10.0,2.0,FINISHED,ORIGINAL,SPRING 2025,2025,Lesprit;Bushiroad Creative;CHOCOLATE,Lesprit,Comedy;Slice of Life,Animals;Primarily Animal Cast;Episodic,,,61.0,0,0,81,0,81,1,5,33,1,13,29,2025-04-15,2025-07-01,,,The third season of <i>YouTuNya</i>.,JP,True,#ユーチューニャー,https://s4.anilist.co/file/anilistcdn/media/anime/cover/medium/bx189602-LVMPUosYYjAW.png,#3586e4,,youtube,d9prXcjnxqU,Nyaa;Tsuyoneko;Tomoneko;Konyaa;Kawaii ne Onee-san,Kyou Yatate (Director);Takada Bear (Character Design);Kyou Yatate (Sound Director);Anchor (Music);Kousuke Nishimoto (Music),Twitter;TikTok;Official Site;Instagram;YouTube;YouTube,False,,https://anilist.co/anime/189602,1761815851,0,0,2025-11-22T04:12:42.749623+00:00,anilist
189716,61379.0,Yurukawa Mell-chan,,ゆるかわメルちゃん,Yurukawa Mell-chan,TV_SHORT,13.0,3.0,FINISHED,OTHER,SPRING 2025,2025,FUNNY MOVIE,FUNNY MOVIE,Slice of Life,Episodic;Gyaru;Advertisement;Kids;Slapstick;Primarily Female Cast,,,36.0,0,0,54,0,54,1,5,17,1,19,12,2025-04-03,2025-06-26,,,"Mell-chan aims to become a professional ""care doll"" and overcomes various training. What exactly is that training... <br><br> (Source: Official site, translated)",JP,True,,https://s4.anilist.co/file/anilistcdn/media/anime/cover/medium/b189716-6r2f88YG3XNP.png,,,youtube,l-AIJCJuEzE,,Rin Kagami (Director),Official Site;YouTube,False,,https://anilist.co/anime/189716,1763111687,0,0,2025-11-22T04:12:42.749640+00:00,anilist
193613,62108.0,Synapusyu THE MOVIE: Pushu Hoppe Dancing PARTY,,シナぷしゅ THE MOVIE ぷしゅほっぺダンシングPARTY,Synapusyu THE MOVIE: Pushu Hoppe Dancing PARTY,MOVIE,1.0,55.0,FINISHED,,SPRING 2025,2025,TV Tokyo;dadab,,Adventure;Fantasy,,,,10.0,0,0,42,0,42,0,6,5,2,8,21,2025-05-16,2025-05-16,,,"Pushu Pushu and Nyuu are on vacation. An accident has taken them to Southern Island Acorn, where they encounter taxi driver Party.",JP,True,#シナぷしゅ #映画シナぷしゅみたよ,https://s4.anilist.co/file/anilistcdn/media/anime/cover/medium/bx193613-appYSBxXrbXL.png,#e4a150,,youtube,HVtl68i9P-U,Nyuu;Pushu Pushu;Party,Takaharu Shimizu (Director);Nobuaki Nobusawa (Music);MINMI (Theme Song Performance);Kanako Iida (Planning);Kanako Iida (Producer),Official Site;TikTok;YouTube;Instagram;Twitter,False,シナぷしゅ THE MOVIE 2;Synapusu The Movie 2,https://anilist.co/anime/193613,1763630394,0,0,2025-11-22T04:12:42.749658+00:00,anilist
199371,,Shinya Ramen no Yuuwaku: SUNTORY Karada wo Omou All-Free CM,,『深夜ラーメンの誘惑』 SUNTORY からだを想うオールフリーCM,Shinya Ramen no Yuuwaku: SUNTORY Karada wo Omou All-Free CM,SPECIAL,1.0,1.0,FINISHED,,SPRING 2025,2025,Andraft,Andraft,Drama,Advertisement;Crossover;Food;Male Protagonist,,,59.0,0,0,35,0,35,0,0,20,0,6,9,2025-06-12,2025-06-12,,,"Web CM for Suntory ALL-FREE non-alcoholic beverage, starring japanese Youtuber SUSURU and with Kouichi Yamadera voicing all the sound effects.",JP,True,#からだを想うオールフリー,https://s4.anilist.co/file/anilistcdn/media/anime/cover/medium/bx199371-gxvEDjfgJQQS.png,#e4935d,https://s4.anilist.co/file/anilistcdn/media/anime/banner/199371-nCHwBO9Mt9Do.jpg,youtube,iX2ejdQt674,SUSURU,Ryuu Nakayama (Director);Michael Tanaka (Supervisor);Chai (Character Design);Narue Kurosawa (Art Director);Shuuya Yoshizato (Color Design),,False,『深夜ラーメンの誘惑』からだを想うオールフリー｜山寺宏一 SUSURU,https://anilist.co/anime/199371,1763767261,0,0,2025-11-22T04:12:42.749676+00:00,anilist
200639,,Q,,キュー,Q,MOVIE,1.0,8.0,FINISHED,ORIGINAL,SPRING 2025,2025,,,,,,,56.0,0,0,33,0,33,0,0,17,0,4,12,2025-05-30,2025-05-30,,,Graduation work of Masataka Kihara at Tama Art University. ,JP,True,,https://s4.anilist.co/file/anilistcdn/media/anime/cover/medium/bx200639-AxI6hMu80so5.png,,,youtube,SXoRBXMmuJM,,Masataka Kihara (Music );Masataka Kihara (Director ),,False,,https://anilist.co/anime/200639,1763024663,0,0,2025-11-22T04:12:42.749691+00:00,anilist
